{
  "$schema": "https://schemas.luh.tech/acronyms-catalog.schema.json",
  "streamUrl": "https://schemas.luh.tech/acronyms-catalog.json",
  "version": "1.2.0",
  "documentId": "ACRONYMS-CATALOG",
  "title": "LuhTech Canonical Glossary / Acronyms Catalog",
  "description": "Canonical LuhTech vocabulary at https://schemas.luh.tech/acronyms-catalog.json. Ingested from canonical_glossary_v1.2 (2026-05-05). Patent-owned sections (B, D, E, E2) are primary; other sections are catalog-derived.",
  "lastUpdated": "2026-05-18T04:08:20Z",
  "author": "Erik Luhtala",
  "sourceMaterial": "sources/canonical_glossary_v1.2.md",
  "scope": {
    "inScope": [
      "LuhTech-coined terms across ten ventures",
      "Industry-standard construction acronyms in active use",
      "Third-party standards, specifications, and regulations",
      "Construction roles, document types, contract forms",
      "Carbon and MRV terminology",
      "Patent-owned cryptographic and positioning vocabulary",
      "Patent law shorthand and Procopio drafting conventions",
      "Prohibited and deprecated terms (with supersession)"
    ],
    "outOfScope": [
      "Quantitative claims and stats — separate provenance system",
      "Per-venture domain assignments — covered by url-catalog.json",
      "Speculative names not yet realized"
    ]
  },
  "statusLegend": {
    "LOCKED": "definition fixed, used in filings as-is.",
    "PATENT-OWNED": "defined here; catalog defers to this Glossary.",
    "DEPRECATED": "historical term, retained for cross-reference only."
  },
  "sections": [
    {
      "id": "A",
      "title": "Cluster and Portfolio Identifiers",
      "ownership": "catalog-derived"
    },
    {
      "id": "B",
      "title": "Data Structures and Provenance",
      "ownership": "patent-owned"
    },
    {
      "id": "C",
      "title": "Spatial Data Model",
      "ownership": "catalog-derived"
    },
    {
      "id": "D",
      "title": "Positioning and Sensor Hardware",
      "ownership": "patent-owned"
    },
    {
      "id": "E",
      "title": "Cryptographic Primitives",
      "ownership": "patent-owned"
    },
    {
      "id": "E2",
      "title": "Coordinate Frame Transform Attestation",
      "ownership": "patent-owned"
    },
    {
      "id": "F",
      "title": "Decision Architecture",
      "ownership": "catalog-derived"
    },
    {
      "id": "G",
      "title": "Atomic Reference Strategy (ARS)",
      "ownership": "catalog-derived"
    },
    {
      "id": "H",
      "title": "Authority Cascades",
      "ownership": "catalog-derived"
    },
    {
      "id": "I",
      "title": "Ventures",
      "ownership": "catalog-derived"
    },
    {
      "id": "J",
      "title": "Service Network Exchange (SNx)",
      "ownership": "catalog-derived"
    },
    {
      "id": "K",
      "title": "Platform Architecture",
      "ownership": "catalog-derived"
    },
    {
      "id": "L",
      "title": "Industry Standards Bodies and Specifications",
      "ownership": "catalog-derived"
    },
    {
      "id": "M",
      "title": "Patent Law Shorthand",
      "ownership": "catalog-derived"
    },
    {
      "id": "N",
      "title": "Standard Drafting Phrases (Procopio Style)",
      "ownership": "catalog-derived"
    },
    {
      "id": "O",
      "title": "Prohibited and Deprecated Terms",
      "ownership": "catalog-derived"
    }
  ],
  "terms": [
    {
      "id": "SBPA",
      "term": "SBPA",
      "expansion": "Spatially-Bound Provenance Architecture",
      "definition": "The unified architecture spanning physically-rooted entropy, sensor hardware, cryptographic field-level provenance, voxel data model, mesh communication, and on-chain anchoring. The umbrella under which the five provisional patent applications sit. \"Spatially-Bound\" carries dual meaning: binding to coordinate frames at every layer of the spatial hierarchy, and binding to spatial sources of entropy at the physical-observation layer.",
      "sourceStatus": "LUHTECH-IP-ARCH-2026-03-10 + Erik 2026-05-05 · LOCKED",
      "status": "LOCKED",
      "section": "A",
      "sectionTitle": "Cluster and Portfolio Identifiers"
    },
    {
      "id": "CTA",
      "term": "CTA",
      "expansion": null,
      "definition": "DEPRECATED. Former umbrella name (\"Cosmological Trust Architecture\") superseded 2026-05-05 by SBPA. Retained here for cross-reference to legacy documents.",
      "sourceStatus": "DEPRECATED — use SBPA",
      "status": "DEPRECATED",
      "section": "A",
      "sectionTitle": "Cluster and Portfolio Identifiers"
    },
    {
      "id": "LUHTECHNOLOGY",
      "term": "LuhTechnology",
      "expansion": null,
      "definition": "Trade name appearing in inventor correspondence and prior public disclosures. USPTO Customer Number 199224 is registered to erik@luhtechnology.com.",
      "sourceStatus": "USPTO 2024-04-17 · LOCKED",
      "status": "LOCKED",
      "section": "A",
      "sectionTitle": "Cluster and Portfolio Identifiers"
    },
    {
      "id": "LUHTECH_HOLDINGS",
      "term": "LuhTech Holdings",
      "expansion": "LTH",
      "definition": "Construction technology venture studio. Parent entity holding nine ventures on a shared open-core platform. Future assignee for CTA patent rights post-filing.",
      "sourceStatus": "Catalog · LOCKED",
      "status": "LOCKED",
      "section": "A",
      "sectionTitle": "Cluster and Portfolio Identifiers"
    },
    {
      "id": "INVENTOR",
      "term": "Inventor",
      "expansion": null,
      "definition": "Erik J. Luhtala. Sole inventor on all CTA filings. Files in inventor's name; assignment to LuhTech Holdings post-filing; license to Ectropy and other ventures downstream.",
      "sourceStatus": "Erik 2026-05-04 · LOCKED",
      "status": "LOCKED",
      "section": "A",
      "sectionTitle": "Cluster and Portfolio Identifiers"
    },
    {
      "id": "CUSTOMER_NUMBER",
      "term": "Customer Number",
      "expansion": null,
      "definition": "199224. Registered 2024-04-17 to erik@luhtechnology.com, role: Independent Inventor. Used on every PTO/SB/16 cover sheet.",
      "sourceStatus": "USPTO acceptance · LOCKED",
      "status": "LOCKED",
      "section": "A",
      "sectionTitle": "Cluster and Portfolio Identifiers"
    },
    {
      "id": "PROCOPIO",
      "term": "Procopio",
      "expansion": null,
      "definition": "Procopio, Cory, Hargreaves & Savitch LLP — patent counsel. Prior counsel of record on US 9,322,165 B2 (Hilja). Engaged for non-provisional conversion of CTA provisionals.",
      "sourceStatus": "LOCKED",
      "status": "LOCKED",
      "section": "A",
      "sectionTitle": "Cluster and Portfolio Identifiers"
    },
    {
      "id": "PROVENANCEFIELD",
      "term": "ProvenanceField",
      "expansion": null,
      "definition": "First-class cryptographic data type. A record comprising at minimum: (a) a sensor measurement value; (b) a voxel identifier; (c) a UWB-validated three-dimensional position; (d) an entropy-seeded sequence position; (e) a chain hash; (f) a building signature; (g) a building identifier. The validated spatial position is a structural input to the chain hash, rendering value and position cryptographically inseparable.",
      "sourceStatus": "P1 v1.0 · PATENT-OWNED",
      "status": "PATENT-OWNED",
      "section": "B",
      "sectionTitle": "Data Structures and Provenance"
    },
    {
      "id": "RVGT",
      "term": "RVGT",
      "expansion": "Rolling Validated Ground Truth",
      "definition": "Append-only, hash-chained sequence into which ProvenanceField records and DecisionEvent records are linked via prev\\_hash references. The integrity primitive of the system. Tamper-evidence emerges from the chain dependency structure.",
      "sourceStatus": "P1 v1.0 · PATENT-OWNED",
      "status": "PATENT-OWNED",
      "section": "B",
      "sectionTitle": "Data Structures and Provenance"
    },
    {
      "id": "CHAIN_HASH",
      "term": "chain\\_hash",
      "expansion": null,
      "definition": "SHA-256 hash computed over the canonical concatenation of a record's fields including its UWB-validated position and the chain hash of the immediately preceding record.",
      "sourceStatus": "P1 v1.0 · PATENT-OWNED",
      "status": "PATENT-OWNED",
      "section": "B",
      "sectionTitle": "Data Structures and Provenance"
    },
    {
      "id": "SEQUENCE_POS",
      "term": "sequence\\_pos",
      "expansion": null,
      "definition": "Position identifier within the RVGT chain. Drawn from physically-irreducible entropy rather than a monotonic counter, to resist adversarial pre-computation of fabricated chain branches.",
      "sourceStatus": "P1 v1.0 · PATENT-OWNED",
      "status": "PATENT-OWNED",
      "section": "B",
      "sectionTitle": "Data Structures and Provenance"
    },
    {
      "id": "PREV_HASH",
      "term": "prev\\_hash",
      "expansion": null,
      "definition": "The chain\\_hash of the immediately preceding record in the same RVGT chain. Linkage primitive that makes the chain append-only.",
      "sourceStatus": "P1 v1.0 · PATENT-OWNED",
      "status": "PATENT-OWNED",
      "section": "B",
      "sectionTitle": "Data Structures and Provenance"
    },
    {
      "id": "DECISIONEVENT",
      "term": "DecisionEvent",
      "expansion": null,
      "definition": "Universal canonical immutable event in @ectropy/schemas. Required fields: $id (URN), schemaVersion, domain (discriminator), timestamp, projectId, actorId, agentType, classification, authorityLevel. All fields readonly. Patent embodiments of cosmologically-seeded decision entropy operate on DecisionEvent records.",
      "sourceStatus": "@ectropy/schemas · LOCKED",
      "status": "LOCKED",
      "section": "B",
      "sectionTitle": "Data Structures and Provenance"
    },
    {
      "id": "DECISIONRECORD",
      "term": "DecisionRecord",
      "expansion": null,